{"candidate_head_sha":"016b5882bf82860ca4d5cd86f1c9955083010f60","change_ids":["CHG-DOCTOR-INTENT-SPLIT-D0","CHG-FRONTEND-MAIN-SPLIT","CHG-GATEWAY-SERVER-SPLIT","CHG-PROXY-LIFECYCLE-SPLIT","CHG-Q0A-CURRENT-DIFF-CARRYFORWARD","CHG-QUALITY-KERNEL-NEXT","CHG-RUNTIME-AUTHORITY-TRANSACTION-S5","CHG-RUNTIME-COMMAND-SPLIT","CHG-RUNTIME-FINALIZE-CONSUMER-H4","CHG-RUNTIME-GATEWAY-CONTROLLER-S6","CHG-RUNTIME-MUTATION-INVENTORY","CHG-RUNTIME-MUTATION-LEASE-S3","CHG-RUNTIME-MUTATION-R0-A","CHG-RUNTIME-MUTATION-R0-B","CHG-RUNTIME-MUTATION-R0-C","CHG-RUNTIME-MUTATION-R0-D","CHG-RUNTIME-MUTATION-R0-F","CHG-RUNTIME-MUTATION-R0-G","CHG-RUNTIME-MUTATION-R0-H","CHG-RUNTIME-RECOVERY-FINALIZE-HIGH","CHG-RUNTIME-SCIENCE-HOST-ADAPTER-S4","CHG-RUNTIME-SCIENCE-OWNER-S2","CHG-RUNTIME-TYPED-FAILURE-R1-A","CHG-RUNTIME-TYPED-FAILURE-R1-B","CHG-RUNTIME-TYPED-FAILURE-R1-C","CHG-RUNTIME-TYPED-FAILURE-R1-D","CHG-RUNTIME-TYPED-FAILURE-R1-E","CHG-RUNTIME-TYPED-FAILURE-R1-F","CHG-RUNTIME-TYPED-JOURNAL-R2-A","CHG-RUNTIME-TYPED-JOURNAL-R2-B","CHG-RUNTIME-TYPED-JOURNAL-R2-C","CHG-RUNTIME-TYPED-JOURNAL-R2-D","CHG-RUNTIME-TYPED-JOURNAL-R2-E","CHG-RUNTIME-TYPED-JOURNAL-R2-F","CHG-RUNTIME-TYPED-SCIENCE-STOP-S1","CHG-SCIENCE-RUNTIME-SPLIT","CHG-SCIENCE-UPDATER-NEXT","CHG-SOURCE-GATE-NEXT","CHG-SSH-LATE-NEXT"],"change_set":[{"paths":[".agents/context/README.md"],"status":"M"},{"paths":[".agents/context/branch-lines.md"],"status":"A"},{"paths":[".agents/context/current-main.md"],"status":"A"},{"paths":[".agents/context/current-release.md"],"status":"M"},{"paths":[".agents/context/document-audit.md"],"status":"D"},{"paths":[".agents/context/known-issues.md"],"status":"M"},{"paths":[".agents/context/verified-state.md"],"status":"M"},{"paths":[".agents/context/worktrees.md"],"status":"D"},{"paths":[".agents/handoffs/README.md"],"status":"M"},{"paths":[".agents/rules/README.md"],"status":"M"},{"paths":[".agents/rules/documentation.md"],"status":"A"},{"paths":[".agents/rules/git-worktrees.md"],"status":"M"},{"paths":[".agents/rules/reviewing.md"],"status":"A"},{"paths":[".agents/rules/safety.md"],"status":"M"},{"paths":[".agents/rules/system-ssh.md"],"status":"M"},{"paths":[".agents/rules/testing-and-evidence.md"],"status":"M"},{"paths":["AGENTS.md"],"status":"M"},{"paths":["README.en.md"],"status":"M"},{"paths":["README.md"],"status":"M"},{"paths":["catalog/capabilities.v1.json"],"status":"M"},{"paths":["desktop/gateway/src/codex_auth/mod.rs"],"status":"M"},{"paths":["desktop/gateway/src/codex_models.rs"],"status":"M"},{"paths":["desktop/gateway/src/server.rs"],"status":"M"},{"paths":["desktop/gateway/src/server/http_codec.rs"],"status":"A"},{"paths":["desktop/gateway/src/server/inference_dispatch.rs"],"status":"A"},{"paths":["desktop/gateway/src/server/skill_bridge_host.rs"],"status":"A"},{"paths":["desktop/gateway/src/server/tests.rs"],"status":"A"},{"paths":["desktop/gateway/src/skill_install.rs"],"status":"M"},{"paths":["desktop/src-tauri/src/codex_auth_supervisor.rs"],"status":"M"},{"paths":["desktop/src-tauri/src/commands/codex.rs"],"status":"M"},{"paths":["desktop/src-tauri/src/commands/diagnostics.rs"],"status":"M"},{"paths":["desktop/src-tauri/src/commands/profiles.rs"],"status":"M"},{"paths":["desktop/src-tauri/src/commands/runtime.rs"],"status":"M"},{"paths":["desktop/src-tauri/src/commands/runtime/actions.rs"],"status":"A"},{"paths":["desktop/src-tauri/src/commands/runtime/gateway.rs"],"status":"A"},{"paths":["desktop/src-tauri/src/commands/runtime/lifecycle.rs"],"status":"A"},{"paths":["desktop/src-tauri/src/commands/runtime/one_click.rs"],"status":"A"},{"paths":["desktop/src-tauri/src/commands/runtime/status.rs"],"status":"A"},{"paths":["desktop/src-tauri/src/commands/runtime/tests.rs"],"status":"A"},{"paths":["desktop/src-tauri/src/commands/skill_install.rs"],"status":"M"},{"paths":["desktop/src-tauri/src/commands/skill_listing.rs"],"status":"M"},{"paths":["desktop/src-tauri/src/commands/skills.rs"],"status":"M"},{"paths":["desktop/src-tauri/src/config.rs"],"status":"M"},{"paths":["desktop/src-tauri/src/lib.rs"],"status":"M"},{"paths":["desktop/src-tauri/src/lifecycle.rs"],"status":"M"},{"paths":["desktop/src-tauri/src/proc.rs"],"status":"M"},{"paths":["desktop/src-tauri/src/runtime/failure.rs"],"status":"A"},{"paths":["desktop/src-tauri/src/runtime/finalize_consumer.rs"],"status":"A"},{"paths":["desktop/src-tauri/src/runtime/launch_env.rs"],"status":"A"},{"paths":["desktop/src-tauri/src/runtime/legacy_proxy.rs"],"status":"M"},{"paths":["desktop/src-tauri/src/runtime/mod.rs"],"status":"M"},{"paths":["desktop/src-tauri/src/runtime/operation.rs"],"status":"M"},{"paths":["desktop/src-tauri/src/runtime/profile.rs"],"status":"M"},{"paths":["desktop/src-tauri/src/runtime/profile_switch.rs"],"status":"M"},{"paths":["desktop/src-tauri/src/runtime/proxy.rs"],"status":"M"},{"paths":["desktop/src-tauri/src/runtime/proxy_lifecycle.rs"],"status":"M"},{"paths":["desktop/src-tauri/src/runtime/proxy_lifecycle/binary.rs"],"status":"A"},{"paths":["desktop/src-tauri/src/runtime/proxy_lifecycle/controller.rs"],"status":"A"},{"paths":["desktop/src-tauri/src/runtime/proxy_lifecycle/launch_contract.rs"],"status":"A"},{"paths":["desktop/src-tauri/src/runtime/proxy_lifecycle/lifecycle.rs"],"status":"A"},{"paths":["desktop/src-tauri/src/runtime/proxy_lifecycle/recovery.rs"],"status":"A"},{"paths":["desktop/src-tauri/src/runtime/proxy_lifecycle/skill_bridge.rs"],"status":"A"},{"paths":["desktop/src-tauri/src/runtime/proxy_lifecycle/tests.rs"],"status":"A"},{"paths":["desktop/src-tauri/src/runtime/sandbox_session.rs"],"status":"M"},{"paths":["desktop/src-tauri/src/runtime/sandbox_session/authority_snapshot.rs"],"status":"A"},{"paths":["desktop/src-tauri/src/runtime/sandbox_session/authority_snapshot/budget.rs"],"status":"A"},{"paths":["desktop/src-tauri/src/runtime/sandbox_session/authority_snapshot/capture.rs"],"status":"A"},{"paths":["desktop/src-tauri/src/runtime/sandbox_session/authority_snapshot/contracts.rs"],"status":"A"},{"paths":["desktop/src-tauri/src/runtime/sandbox_session/authority_snapshot/filesystem.rs"],"status":"A"},{"paths":["desktop/src-tauri/src/runtime/sandbox_session/authority_snapshot/restore.rs"],"status":"A"},{"paths":["desktop/src-tauri/src/runtime/sandbox_session/authority_snapshot/test_seams.rs"],"status":"A"},{"paths":["desktop/src-tauri/src/runtime/sandbox_session/authority_transaction.rs"],"status":"A"},{"paths":["desktop/src-tauri/src/runtime/sandbox_session/catalog_verify.rs"],"status":"A"},{"paths":["desktop/src-tauri/src/runtime/sandbox_session/mod.rs"],"status":"A"},{"paths":["desktop/src-tauri/src/runtime/sandbox_session/one_click.rs"],"status":"A"},{"paths":["desktop/src-tauri/src/runtime/sandbox_session/one_click/healthy_reopen.rs"],"status":"A"},{"paths":["desktop/src-tauri/src/runtime/sandbox_session/pending_cleanup.rs"],"status":"A"},{"paths":["desktop/src-tauri/src/runtime/sandbox_session/recovery.rs"],"status":"A"},{"paths":["desktop/src-tauri/src/runtime/sandbox_session/route_reconcile.rs"],"status":"A"},{"paths":["desktop/src-tauri/src/runtime/sandbox_session/ssh_preflight.rs"],"status":"A"},{"paths":["desktop/src-tauri/src/runtime/sandbox_session/transaction_tests.rs"],"status":"A"},{"paths":["desktop/src-tauri/src/runtime/sandbox_session/transaction_tests/authority_snapshot.rs"],"status":"A"},{"paths":["desktop/src-tauri/src/runtime/sandbox_session/transaction_tests/cleanup_recovery.rs"],"status":"A"},{"paths":["desktop/src-tauri/src/runtime/sandbox_session/transaction_tests/gateway_catalog.rs"],"status":"A"},{"paths":["desktop/src-tauri/src/runtime/sandbox_session/transaction_tests/runtime_journal.rs"],"status":"A"},{"paths":["desktop/src-tauri/src/runtime/sandbox_session/transaction_tests/ssh_behavior.rs"],"status":"A"},{"paths":["desktop/src-tauri/src/runtime/sandbox_session/transaction_tests/ssh_contract.rs"],"status":"A"},{"paths":["desktop/src-tauri/src/runtime/sandbox_session/transaction_tests/transaction_contract.rs"],"status":"A"},{"paths":["desktop/src-tauri/src/runtime/science.rs"],"status":"M"},{"paths":["desktop/src-tauri/src/runtime/science/contracts.rs"],"status":"A"},{"paths":["desktop/src-tauri/src/runtime/science/executable.rs"],"status":"A"},{"paths":["desktop/src-tauri/src/runtime/science/host_adapter.rs"],"status":"A"},{"paths":["desktop/src-tauri/src/runtime/science/lifecycle.rs"],"status":"A"},{"paths":["desktop/src-tauri/src/runtime/science/managed_launch.rs"],"status":"A"},{"paths":["desktop/src-tauri/src/runtime/science/runtime_state.rs"],"status":"A"},{"paths":["desktop/src-tauri/src/runtime/science/tests.rs"],"status":"A"},{"paths":["desktop/src-tauri/src/runtime/skill_install_bridge.rs"],"status":"M"},{"paths":["desktop/src-tauri/src/runtime/system.rs"],"status":"M"},{"paths":["desktop/src-tauri/src/scratch.rs"],"status":"M"},{"paths":["desktop/src/codex-controller.js"],"status":"A"},{"paths":["desktop/src/index.html"],"status":"M"},{"paths":["desktop/src/ipc-client.js"],"status":"A"},{"paths":["desktop/src/main.js"],"status":"M"},{"paths":["desktop/src/preview-adapter.js"],"status":"A"},{"paths":["desktop/src/profile-controller.js"],"status":"A"},{"paths":["desktop/src/runtime-controller.js"],"status":"A"},{"paths":["docs/ARCHITECTURE.md"],"status":"M"},{"paths":["docs/DEVELOPMENT.md"],"status":"M"},{"paths":["docs/EXTERNAL_SKILL_INSTALL.md"],"status":"M"},{"paths":["docs/README.md"],"status":"M"},{"paths":["docs/RELEASE.md"],"status":"M"},{"paths":["docs/SCIENCE_RUNTIME.md"],"status":"M"},{"paths":["docs/architecture/README.md"],"status":"M"},{"paths":["docs/architecture/desktop-control-plane.md"],"status":"A"},{"paths":["docs/architecture/gateway-provider-routing.md"],"status":"A"},{"paths":["docs/architecture/overview.md"],"status":"M"},{"paths":["docs/architecture/runtime-state-transactions.md"],"status":"A"},{"paths":["docs/architecture/science-capability-dependencies.md"],"status":"A"},{"paths":["docs/architecture/science-runtime.md"],"status":"M"},{"paths":["docs/assets/wechat-group.jpg"